{
  "$schema": "https://json-schema.org/draft/2020-12/schema",
  "$id": "matso:mobility_matrix:0.1.0",
  "title": "MobilityMatrix",
  "description": "機動成本矩陣（`contracts/mobility_matrix.json` 的出貨預設，以及想定的 `overrides/mobility_matrix.json` 局部覆寫）。公式：step_cost = profiles[profile][terrain_class] × (1 + slope_penalty[profile] × slope_deg / 45)。**覆寫檔是局部的**：只列要改的鍵，其餘沿用出貨預設（深合併）。⚠ 覆寫**不得改變可通行性**（既有的 -1 不可改成正數、正數不可改成 -1）——路徑規劃 A* 跑在 terrain 容器、讀它自己那份出貨預設，看不到想定覆寫；改可通行性會讓規劃端與執行端對「這條路走不走得通」意見不一致（規劃穿過不可通行地形 → 單位半路停死；或判不可達 → 退回直線穿越）。改速度只影響路線是否最省時，路線本身仍然可走。此限制由 loader 強制。",
  "type": "object",
  "additionalProperties": false,
  "properties": {
    "$comment": { "type": "string" },
    "version": { "type": "string" },
    "profiles": {
      "type": "object",
      "description": "mobility_profile → terrain_class → 每格基準成本倍率（-1＝不可通行）",
      "propertyNames": { "pattern": "^[A-Z][A-Z0-9_]*$" },
      "additionalProperties": {
        "type": "object",
        "propertyNames": { "pattern": "^[A-Z][A-Z0-9_]*$" },
        "additionalProperties": {
          "type": "number",
          "description": "> 0 ＝成本倍率（越大越難走）；-1 ＝不可通行"
        }
      }
    },
    "slope_penalty": {
      "type": "object",
      "description": "profile → 坡度附加係數；`$comment` 為說明字串，非 profile",
      "additionalProperties": {
        "anyOf": [{ "type": "number", "minimum": 0 }, { "type": "string" }]
      }
    },
    "road": {
      "type": "object",
      "additionalProperties": false,
      "properties": {
        "$comment": { "type": "string" },
        "speed_factor_by_class": {
          "type": "object",
          "description": "OSM road_class → 速度係數（0 < f ≤ 1）",
          "additionalProperties": { "type": "number", "exclusiveMinimum": 0, "maximum": 1 }
        },
        "usable_by_profile": {
          "type": "object",
          "description": "profile → 是否可用道路",
          "additionalProperties": { "type": "boolean" }
        }
      }
    }
  }
}
