{
  "$comment": "營級防禦想定的機動覆寫（SPEC_FULL §4.3；局部覆寫，只列要改的鍵，其餘沿用 contracts/mobility_matrix.json）。大漢溪為典型的礫石辮狀河床：枯水期看似可徒涉，實際上河灘的鬆散礫石與泥灘會讓履帶車輛陷車、徒步部隊亦難以維持隊形——這正是本場把河線當障礙的物理基礎，故 WETLAND 成本一律調高。東岸河階台地的次生林與竹林比一般森林更密（藤蔓與竹叢阻礙履帶），大溪老街一帶巷弄狹窄且多轉角，裝甲車輛難以展開，故 FOREST/URBAN 亦調高。坡度係數只動 TRACKED：河階崖線是連續陡坎，履帶車輛必須繞行找緩坡。⚠ 覆寫不得改變可通行性（-1 進出）——A* 在 terrain 服務讀自己那份出貨預設，看不到本檔；改可通行性會讓規劃端與執行端對「走不走得通」意見不一致。本檔只調速度倍率，未觸及任何 -1 的鍵（例如 WHEELED.WETLAND 仍為不可通行）。",
  "version": "1.0.0",
  "profiles": {
    "FOOT": {
      "WETLAND": 3.0,
      "FOREST": 1.8
    },
    "TRACKED": {
      "WETLAND": 5.0,
      "FOREST": 3.2,
      "URBAN": 1.4
    },
    "WHEELED": {
      "FOREST": 4.5,
      "URBAN": 1.2
    }
  },
  "slope_penalty": {
    "TRACKED": 2.5
  }
}
